scenario,route,status,evidence_scope,requirements,evidence_tests,evidence_artifacts,runtime_provider,implementation_lane,counts_as_python_2025_rti,wrapper_only,notes
ddm,python-2025-inprocess,parity-covered,scenario-parity,HLA2025-MOD-007; HLA2025-NEW-004; HLA2025-FI-001,tests/test_rti1516_2025_python2025_runtime.py,tests/test_rti1516_2025_python2025_runtime.py,python2025,hla-backend-python2025,true,false,"Current Python 2025 RTI covers object-region filtering, passive object and interaction region-subscribe aliases, scope advisory callbacks, and 2025 default attribute policy calls."
ddm,python-2025-fedpro-grpc,parity-covered,scenario-parity,HLA2025-MOD-007; HLA2025-BND-003,tests/transport/test_grpc_transport_2025.py; tests/scenarios/test_python_route_parity.py,tests/transport/test_grpc_transport_2025.py; docs/plans/spec2025_finish_line_snapshot.json,python2025,hla-backend-python2025,true,false,"Hosted FedPro 2025 route covers object attribute subscribe-with-rate and passive subscribe-with-rate aliases, object attribute, interaction class, and directed interaction region-overlap filtering with conveyed region evidence plus DDM-driven attributesInScope/attributesOutOfScope transitions, region subscribe/unsubscribe, associate/unassociate, and delete-region cleanup. Explicit hosted-route identity proof shows the direct ambassador, hosted server, and hosted client all identify python2025 / hla-backend-python2025 as the primary 2025 Python RTI implementation lane, with counts_as_python_2025_rti=true and wrapper_only=false where those fields apply. Treat remaining hosted FedPro proof here as transport-seam evidence over hla-backend-python2025 rather than evidence that the main 2025 Python RTI lane lacks the underlying semantics."
ddm,java-standard-2025-jpype,parity-covered,scenario-parity,HLA2025-MOD-007; HLA2025-BND-001,tests/backends/test_standard_shim_artifacts.py,docs/evidence/shim_routes/java-standard-2025.json; docs/evidence/shim_routes/route_traces/java-standard-2025-jpype.json,python2025,hla-backend-python2025,false,false,"Java 2025 JPype standard route runs the DDM region runtime trace through the official API compile artifact gate: object attribute region subscription, outside-region suppression, discovery after region overlap, and conveyed sent-region reflection evidence. These binding/wrapper routes are executed over the primary python2025 runtime lane in hla-backend-python2025, with the Java/C++ packages limited to compatibility and API adaptation. Treat Java/C++ route parity here as binding/adaptation-seam evidence over the main hla-backend-python2025 runtime, not as alternate ownership of core 2025 RTI semantics."
ddm,java-standard-2025-py4j,parity-covered,scenario-parity,HLA2025-MOD-007; HLA2025-BND-001,tests/backends/test_standard_shim_artifacts.py,docs/evidence/shim_routes/java-standard-2025.json; docs/evidence/shim_routes/route_traces/java-standard-2025-py4j.json,python2025,hla-backend-python2025,false,false,"Java 2025 Py4J standard route runs the DDM region runtime trace through the official API compile artifact gate: object attribute region subscription, outside-region suppression, discovery after region overlap, and conveyed sent-region reflection evidence. These binding/wrapper routes are executed over the primary python2025 runtime lane in hla-backend-python2025, with the Java/C++ packages limited to compatibility and API adaptation. Treat Java/C++ route parity here as binding/adaptation-seam evidence over the main hla-backend-python2025 runtime, not as alternate ownership of core 2025 RTI semantics."
ddm,cpp-standard-2025-pybind,parity-covered,scenario-parity,HLA2025-MOD-007; HLA2025-BND-002,tests/backends/test_standard_shim_artifacts.py,docs/evidence/shim_routes/cpp-standard-2025.json; docs/evidence/shim_routes/route_traces/cpp-standard-2025-pybind.json,python2025,hla-backend-python2025,false,false,"C++ 2025 pybind standard route runs the DDM region runtime trace: object attribute region subscription, outside-region suppression, discovery after region overlap, and conveyed sent-region reflection evidence. These binding/wrapper routes are executed over the primary python2025 runtime lane in hla-backend-python2025, with the Java/C++ packages limited to compatibility and API adaptation. Treat Java/C++ route parity here as binding/adaptation-seam evidence over the main hla-backend-python2025 runtime, not as alternate ownership of core 2025 RTI semantics."
ddm,cpp-standard-2025-grpc,parity-covered,scenario-parity,HLA2025-MOD-007; HLA2025-BND-002,tests/backends/test_standard_shim_artifacts.py,docs/evidence/shim_routes/cpp-standard-2025.json; docs/evidence/shim_routes/route_traces/cpp-standard-2025-grpc.json,python2025,hla-backend-python2025,false,false,"C++ 2025 gRPC standard route runs the DDM region runtime trace: object attribute region subscription, outside-region suppression, discovery after region overlap, and conveyed sent-region reflection evidence. These binding/wrapper routes are executed over the primary python2025 runtime lane in hla-backend-python2025, with the Java/C++ packages limited to compatibility and API adaptation. Treat Java/C++ route parity here as binding/adaptation-seam evidence over the main hla-backend-python2025 runtime, not as alternate ownership of core 2025 RTI semantics."
federation_lifecycle,python-2025-inprocess,parity-covered,scenario-parity,HLA2025-FI-005; HLA2025-FI-006,tests/test_rti1516_2025_python2025_runtime.py,tests/test_rti1516_2025_python2025_runtime.py,python2025,hla-backend-python2025,true,false,"Current Python 2025 RTI covers connect, create, createFederationExecutionWithMIM, join, resign, destroy, disconnect, evoked callback polling, and direct inline immediate callback delivery."
federation_lifecycle,python-2025-fedpro-grpc,parity-covered,scenario-parity,HLA2025-FI-005; HLA2025-FI-006; HLA2025-BND-003,tests/transport/test_grpc_transport_2025.py; tests/scenarios/test_python_route_parity.py,tests/transport/test_grpc_transport_2025.py; docs/plans/spec2025_finish_line_snapshot.json,python2025,hla-backend-python2025,true,false,"Hosted FedPro 2025 route covers the same lifecycle session through typed protobuf calls plus real shared federation listing plus real listFederationExecutions/listFederationExecutionMembers callback flow, explicit factory-hosted create_rti_ambassador('python2025', transport=...) execution of direct federation listing and member-report callbacks through the hosted 2025 ambassador surface, shared join-precondition rejection for not-connected, missing-federation, duplicate-name, already-joined, save-in-progress, and restore-in-progress cases, shared resign-precondition rejection for not-connected, not-joined, invalid-action, owned-attribute, and pending-acquisition cases, shared multi-participation across primary and secondary federations, shared resign/disconnect MOM cleanup, shared lost-federate MOM reporting plus automatic object cleanup, shared single-module and multi-module federation FOM visibility plus incompatible-join FOM integrity rejection, explicit single-FOM and createFederationExecutionWithMIM transport-command routing, MIM-data alias normalization, missing-federation member notices, and federateResigned callback delivery. Explicit hosted-route identity proof shows the direct ambassador, hosted server, and hosted client all identify python2025 / hla-backend-python2025 as the primary 2025 Python RTI implementation lane, with counts_as_python_2025_rti=true and wrapper_only=false where those fields apply. Treat remaining hosted FedPro proof here as transport-seam evidence over hla-backend-python2025 rather than evidence that the main 2025 Python RTI lane lacks the underlying semantics."
federation_lifecycle,java-standard-2025-jpype,parity-covered,scenario-parity,HLA2025-BND-001; HLA2025-FI-003; HLA2025-FI-004; HLA2025-FI-005; HLA2025-FI-006,tests/backends/test_standard_shim_artifacts.py,docs/evidence/shim_routes/java-standard-2025.json; docs/evidence/shim_routes/route_traces/java-standard-2025-jpype.json,python2025,hla-backend-python2025,false,false,"Java 2025 JPype standard route runs the lifecycle scenario through the official API compile artifact gate: connect, create, join, evoked callback polling, resign, destroy, and disconnect. These binding/wrapper routes are executed over the primary python2025 runtime lane in hla-backend-python2025, with the Java/C++ packages limited to compatibility and API adaptation. Treat Java/C++ route parity here as binding/adaptation-seam evidence over the main hla-backend-python2025 runtime, not as alternate ownership of core 2025 RTI semantics."
federation_lifecycle,java-standard-2025-py4j,parity-covered,scenario-parity,HLA2025-BND-001; HLA2025-FI-003; HLA2025-FI-004; HLA2025-FI-005; HLA2025-FI-006,tests/backends/test_standard_shim_artifacts.py,docs/evidence/shim_routes/java-standard-2025.json; docs/evidence/shim_routes/route_traces/java-standard-2025-py4j.json,python2025,hla-backend-python2025,false,false,"Java 2025 Py4J standard route runs the lifecycle scenario through the official API compile artifact gate: connect, create, join, evoked callback polling, resign, destroy, and disconnect. These binding/wrapper routes are executed over the primary python2025 runtime lane in hla-backend-python2025, with the Java/C++ packages limited to compatibility and API adaptation. Treat Java/C++ route parity here as binding/adaptation-seam evidence over the main hla-backend-python2025 runtime, not as alternate ownership of core 2025 RTI semantics."
federation_lifecycle,cpp-standard-2025-pybind,parity-covered,scenario-parity,HLA2025-BND-002; HLA2025-FI-003; HLA2025-FI-004; HLA2025-FI-005; HLA2025-FI-006,tests/backends/test_standard_shim_artifacts.py,docs/evidence/shim_routes/cpp-standard-2025.json; docs/evidence/shim_routes/route_traces/cpp-standard-2025-pybind.json,python2025,hla-backend-python2025,false,false,"C++ 2025 pybind standard route runs the lifecycle scenario: connect, create, join, evoked callback polling, resign, destroy, and disconnect. These binding/wrapper routes are executed over the primary python2025 runtime lane in hla-backend-python2025, with the Java/C++ packages limited to compatibility and API adaptation. Treat Java/C++ route parity here as binding/adaptation-seam evidence over the main hla-backend-python2025 runtime, not as alternate ownership of core 2025 RTI semantics."
federation_lifecycle,cpp-standard-2025-grpc,parity-covered,scenario-parity,HLA2025-BND-002; HLA2025-FI-003; HLA2025-FI-004; HLA2025-FI-005; HLA2025-FI-006,tests/backends/test_standard_shim_artifacts.py,docs/evidence/shim_routes/cpp-standard-2025.json; docs/evidence/shim_routes/route_traces/cpp-standard-2025-grpc.json,python2025,hla-backend-python2025,false,false,"C++ 2025 gRPC standard route runs the lifecycle scenario: connect, create, join, evoked callback polling, resign, destroy, and disconnect. These binding/wrapper routes are executed over the primary python2025 runtime lane in hla-backend-python2025, with the Java/C++ packages limited to compatibility and API adaptation. Treat Java/C++ route parity here as binding/adaptation-seam evidence over the main hla-backend-python2025 runtime, not as alternate ownership of core 2025 RTI semantics."
mom,python-2025-inprocess,parity-covered,scenario-parity,HLA2025-NEW-004; HLA2025-FI-001,tests/test_rti1516_2025_python2025_runtime.py,tests/test_rti1516_2025_python2025_runtime.py,python2025,hla-backend-python2025,true,false,"Current Python 2025 RTI records MOM switch/report serialization slices and routes MIM data, FOM module data, synchronization point MOM request/report interactions, and service/exception reporting MOM adjust interactions plus exposed HLAsetSwitches adjust interactions and HLAsetTiming/HLAmodifyAttributeState adjust interactions plus federate-level FOM module data, publication/subscription, and object-instance information MOM reports, and declaration-management MOM service actions plus federation-management MOM service actions and supported time-management MOM service actions including disable/asynchronous/TARA/NMR/NMRA, supported object-management MOM service actions including transportation/order-type changes, supported ownership MOM service actions, activity/count MOM reports, MOM exception reports for failed routed MOM actions, and an executable audit that every non-report manager command leaf in the bundled MIM is declared routed."
mom,python-2025-fedpro-grpc,parity-covered,scenario-parity,HLA2025-NEW-004; HLA2025-BND-003,tests/transport/test_grpc_transport_2025.py; tests/scenarios/test_python_route_parity.py,tests/transport/test_grpc_transport_2025.py; docs/plans/spec2025_finish_line_snapshot.json,python2025,hla-backend-python2025,true,false,"Hosted FedPro 2025 route emits MOM service-invocation report callbacks, reports MIM data for HLArequestMIMdata, reports FOM module data for HLArequestFOMmoduleData, reports object publication/subscription state for HLArequestPublications and HLArequestSubscriptions, reports object instance information and object-instance counts, reports activity counts for updates/reflections/interactions, reports synchronization points/status, proves direct synchronization registration/announce/achieved/federation-synchronized callbacks, proves explicit factory-hosted create_rti_ambassador('python2025', transport=...) execution of MOM federation-management save/restore service interactions plus MOM time-management service interactions through the direct 2025 ambassador surface, proves requestRetraction callback delivery after delivered timestamp-order receipt, round-trips 2025 switch services, emits HLAreportMOMexception for failed routed MOM actions, and routes all hosted MOM manager adjust/service command leaves with representative state and callback effects. Explicit hosted-route identity proof shows the direct ambassador, hosted server, and hosted client all identify python2025 / hla-backend-python2025 as the primary 2025 Python RTI implementation lane, with counts_as_python_2025_rti=true and wrapper_only=false where those fields apply. Treat remaining hosted FedPro proof here as transport-seam evidence over hla-backend-python2025 rather than evidence that the main 2025 Python RTI lane lacks the underlying semantics."
mom,java-standard-2025-jpype,parity-covered,scenario-parity,HLA2025-NEW-004; HLA2025-FI-001; HLA2025-BND-001,tests/backends/test_standard_shim_artifacts.py,docs/evidence/shim_routes/java-standard-2025.json; docs/evidence/shim_routes/route_traces/java-standard-2025-jpype.json,python2025,hla-backend-python2025,false,false,"Java 2025 JPype standard route runs the MOM runtime trace through the official API compile artifact gate: service report callback delivery, FOM module data report, MIM data report, and MOM adjust interaction routing for service-reporting switches. These binding/wrapper routes are executed over the primary python2025 runtime lane in hla-backend-python2025, with the Java/C++ packages limited to compatibility and API adaptation. Treat Java/C++ route parity here as binding/adaptation-seam evidence over the main hla-backend-python2025 runtime, not as alternate ownership of core 2025 RTI semantics."
mom,java-standard-2025-py4j,parity-covered,scenario-parity,HLA2025-NEW-004; HLA2025-FI-001; HLA2025-BND-001,tests/backends/test_standard_shim_artifacts.py,docs/evidence/shim_routes/java-standard-2025.json; docs/evidence/shim_routes/route_traces/java-standard-2025-py4j.json,python2025,hla-backend-python2025,false,false,"Java 2025 Py4J standard route runs the MOM runtime trace through the official API compile artifact gate: service report callback delivery, FOM module data report, MIM data report, and MOM adjust interaction routing for service-reporting switches. These binding/wrapper routes are executed over the primary python2025 runtime lane in hla-backend-python2025, with the Java/C++ packages limited to compatibility and API adaptation. Treat Java/C++ route parity here as binding/adaptation-seam evidence over the main hla-backend-python2025 runtime, not as alternate ownership of core 2025 RTI semantics."
mom,cpp-standard-2025-pybind,parity-covered,scenario-parity,HLA2025-NEW-004; HLA2025-FI-001; HLA2025-BND-002,tests/backends/test_standard_shim_artifacts.py,docs/evidence/shim_routes/cpp-standard-2025.json; docs/evidence/shim_routes/route_traces/cpp-standard-2025-pybind.json,python2025,hla-backend-python2025,false,false,"C++ 2025 pybind standard route runs the MOM runtime trace: service report callback delivery, FOM module data report, MIM data report, and MOM adjust interaction routing for service-reporting switches. These binding/wrapper routes are executed over the primary python2025 runtime lane in hla-backend-python2025, with the Java/C++ packages limited to compatibility and API adaptation. Treat Java/C++ route parity here as binding/adaptation-seam evidence over the main hla-backend-python2025 runtime, not as alternate ownership of core 2025 RTI semantics."
mom,cpp-standard-2025-grpc,parity-covered,scenario-parity,HLA2025-NEW-004; HLA2025-FI-001; HLA2025-BND-002,tests/backends/test_standard_shim_artifacts.py,docs/evidence/shim_routes/cpp-standard-2025.json; docs/evidence/shim_routes/route_traces/cpp-standard-2025-grpc.json,python2025,hla-backend-python2025,false,false,"C++ 2025 gRPC standard route runs the MOM runtime trace: service report callback delivery, FOM module data report, MIM data report, and MOM adjust interaction routing for service-reporting switches. These binding/wrapper routes are executed over the primary python2025 runtime lane in hla-backend-python2025, with the Java/C++ packages limited to compatibility and API adaptation. Treat Java/C++ route parity here as binding/adaptation-seam evidence over the main hla-backend-python2025 runtime, not as alternate ownership of core 2025 RTI semantics."
object_exchange,python-2025-inprocess,parity-covered,scenario-parity,HLA2025-FR-003; HLA2025-FR-004; HLA2025-FI-001,tests/test_rti1516_2025_python2025_runtime.py,tests/test_rti1516_2025_python2025_runtime.py,python2025,hla-backend-python2025,true,false,"Current Python 2025 RTI covers FOM-backed publish/subscribe, passive object and interaction subscribe aliases, universal directed subscribe alias, discovery, attribute reflection, interaction receipt, and directed interaction receipt."
object_exchange,python-2025-fedpro-grpc,parity-covered,scenario-parity,HLA2025-FR-003; HLA2025-FR-004; HLA2025-BND-003,tests/transport/test_grpc_transport_2025.py; tests/scenarios/test_python_route_parity.py,tests/transport/test_grpc_transport_2025.py; docs/plans/spec2025_finish_line_snapshot.json,python2025,hla-backend-python2025,true,false,"Hosted FedPro 2025 route covers passive object and interaction subscribe aliases, universal directed subscribe alias, object discovery, attribute reflection, interaction receipt, explicit factory-hosted create_rti_ambassador('python2025', transport=...) execution of direct object discovery, reflection, and interaction receipt through the hosted 2025 ambassador surface, directed interaction receipt, time-managed declaration independence, selective directed set unsubscribe/unpublish, invalid attribute-publication rejection, post-unpublish object/interaction send rejection, and timestamped variants. Explicit hosted-route identity proof shows the direct ambassador, hosted server, and hosted client all identify python2025 / hla-backend-python2025 as the primary 2025 Python RTI implementation lane, with counts_as_python_2025_rti=true and wrapper_only=false where those fields apply. Treat remaining hosted FedPro proof here as transport-seam evidence over hla-backend-python2025 rather than evidence that the main 2025 Python RTI lane lacks the underlying semantics."
object_exchange,java-standard-2025-jpype,parity-covered,scenario-parity,HLA2025-BND-001; HLA2025-FI-004,tests/backends/test_standard_shim_artifacts.py,docs/evidence/shim_routes/java-standard-2025.json; docs/evidence/shim_routes/route_traces/java-standard-2025-jpype.json,python2025,hla-backend-python2025,false,false,"Java 2025 JPype standard route runs the two-federate object exchange trace through the official API compile artifact gate: subscribe, discover, publish, reflect attributes, publish/receive interaction, and unsubscribe suppression. These binding/wrapper routes are executed over the primary python2025 runtime lane in hla-backend-python2025, with the Java/C++ packages limited to compatibility and API adaptation. Treat Java/C++ route parity here as binding/adaptation-seam evidence over the main hla-backend-python2025 runtime, not as alternate ownership of core 2025 RTI semantics."
object_exchange,java-standard-2025-py4j,parity-covered,scenario-parity,HLA2025-BND-001; HLA2025-FI-004,tests/backends/test_standard_shim_artifacts.py,docs/evidence/shim_routes/java-standard-2025.json; docs/evidence/shim_routes/route_traces/java-standard-2025-py4j.json,python2025,hla-backend-python2025,false,false,"Java 2025 Py4J standard route runs the two-federate object exchange trace through the official API compile artifact gate: subscribe, discover, publish, reflect attributes, publish/receive interaction, and unsubscribe suppression. These binding/wrapper routes are executed over the primary python2025 runtime lane in hla-backend-python2025, with the Java/C++ packages limited to compatibility and API adaptation. Treat Java/C++ route parity here as binding/adaptation-seam evidence over the main hla-backend-python2025 runtime, not as alternate ownership of core 2025 RTI semantics."
object_exchange,cpp-standard-2025-pybind,parity-covered,scenario-parity,HLA2025-BND-002; HLA2025-FI-004,tests/backends/test_standard_shim_artifacts.py,docs/evidence/shim_routes/cpp-standard-2025.json; docs/evidence/shim_routes/route_traces/cpp-standard-2025-pybind.json,python2025,hla-backend-python2025,false,false,"C++ 2025 pybind standard route runs the two-federate object exchange trace: subscribe, discover, publish, reflect attributes, publish/receive interaction, and unsubscribe suppression. These binding/wrapper routes are executed over the primary python2025 runtime lane in hla-backend-python2025, with the Java/C++ packages limited to compatibility and API adaptation. Treat Java/C++ route parity here as binding/adaptation-seam evidence over the main hla-backend-python2025 runtime, not as alternate ownership of core 2025 RTI semantics."
object_exchange,cpp-standard-2025-grpc,parity-covered,scenario-parity,HLA2025-BND-002; HLA2025-FI-004,tests/backends/test_standard_shim_artifacts.py,docs/evidence/shim_routes/cpp-standard-2025.json; docs/evidence/shim_routes/route_traces/cpp-standard-2025-grpc.json,python2025,hla-backend-python2025,false,false,"C++ 2025 gRPC standard route runs the two-federate object exchange trace: subscribe, discover, publish, reflect attributes, publish/receive interaction, and unsubscribe suppression. These binding/wrapper routes are executed over the primary python2025 runtime lane in hla-backend-python2025, with the Java/C++ packages limited to compatibility and API adaptation. Treat Java/C++ route parity here as binding/adaptation-seam evidence over the main hla-backend-python2025 runtime, not as alternate ownership of core 2025 RTI semantics."
ownership,python-2025-inprocess,parity-covered,scenario-parity,HLA2025-FR-005; HLA2025-FR-008; HLA2025-FI-001,tests/test_rti1516_2025_python2025_runtime.py,tests/test_rti1516_2025_python2025_runtime.py,python2025,hla-backend-python2025,true,false,"Current Python 2025 RTI covers basic, negotiated, cancellation, unavailable, release-denied, and resign ownership slices, plus save/restore rollback of in-flight acquisition/divestiture state and cross-federate owner-visibility recovery."
ownership,python-2025-fedpro-grpc,parity-covered,scenario-parity,HLA2025-FR-005; HLA2025-BND-003,tests/transport/test_grpc_transport_2025.py; tests/scenarios/test_python_route_parity.py,tests/transport/test_grpc_transport_2025.py; docs/plans/spec2025_finish_line_snapshot.json,python2025,hla-backend-python2025,true,false,"Hosted FedPro 2025 route covers unavailable acquisition, basic divest/acquire/query callbacks, non-owner update rejection, negotiated divestiture, confirm-divestiture completion, release requests, release denial, acquisition cancellation, divestiture-if-wanted, RTI-owned MOM attribute ownership query callbacks, and cancel-negotiated-offer callbacks, explicit factory-hosted create_rti_ambassador('python2025', transport=...) execution of the smoke save/restore ownership rollback gauntlet plus owned-attribute reacquisition rejection, non-owner divestiture rejection, unowned query callbacks, fresh acquisition notification, informed-owner query callbacks, restored in-flight ownership negotiation state, and restored cross-federate owner-visibility callbacks through the direct 2025 ambassador surface; save/restore recovery of in-flight ownership negotiation state and restored cross-federate owner-visibility callbacks are also exercised over the hosted FedPro route; resign-time divest/delete/cancel ownership policies are exercised over the FedPro route. Explicit hosted-route identity proof shows the direct ambassador, hosted server, and hosted client all identify python2025 / hla-backend-python2025 as the primary 2025 Python RTI implementation lane, with counts_as_python_2025_rti=true and wrapper_only=false where those fields apply. Treat remaining hosted FedPro proof here as transport-seam evidence over hla-backend-python2025 rather than evidence that the main 2025 Python RTI lane lacks the underlying semantics."
